{
  "call_run_id": "callrun_demo123",
  "client_id": "client_abc",
  "dp_id": "dp_xyz",
  "scheduled_at": "2026-03-20T15:00:00+00:00",
  "p0_instruction": "Emphasize approvals needed for homepage launch.",
  "current_state": "pre_call_requested",
  "source_refs": [],
  "created_at": "2026-03-13T12:00:00+00:00",
  "updated_at": "2026-03-13T12:00:00+00:00"
}
